{
  "persona_id": "550e8400-e29b-41d4-a716-446655440002",
  "version": "1.0.0",
  "name": "Generic Ransomware Operator",
  "category": "cybercriminal",
  "classification_level": "UNCLASS",
  "description": "Generic ransomware operator persona representing typical financially-motivated cybercriminal groups using ransomware-as-a-service (RaaS) or custom ransomware. Focuses on rapid compromise, lateral movement, and data encryption for extortion.",
  "attribution": {
    "country": "Unknown",
    "group_names": [
      "Generic RaaS Affiliate"
    ],
    "mitre_groups": [],
    "active_since": "2019-01-01",
    "targets": [
      "Healthcare",
      "Education",
      "Manufacturing",
      "Small Business",
      "Local Government"
    ]
  },
  "capabilities": {
    "sophistication": "medium",
    "resources": "moderate",
    "persistence": "targeted",
    "stealth": "moderate",
    "zero_days": false,
    "custom_malware": false,
    "supply_chain": false
  },
  "ttps": {
    "preferred_tactics": [
      "TA0001",
      "TA0002",
      "TA0003",
      "TA0006",
      "TA0008",
      "TA0040"
    ],
    "techniques": [
      {
        "technique_id": "T1566.001",
        "name": "Spearphishing Attachment",
        "preference_weight": 0.9,
        "subtechniques": []
      },
      {
        "technique_id": "T1190",
        "name": "Exploit Public-Facing Application",
        "preference_weight": 0.85,
        "subtechniques": []
      },
      {
        "technique_id": "T1133",
        "name": "External Remote Services",
        "preference_weight": 0.8,
        "subtechniques": []
      },
      {
        "technique_id": "T1059.001",
        "name": "PowerShell",
        "preference_weight": 0.9,
        "subtechniques": []
      },
      {
        "technique_id": "T1486",
        "name": "Data Encrypted for Impact",
        "preference_weight": 1.0,
        "subtechniques": []
      },
      {
        "technique_id": "T1490",
        "name": "Inhibit System Recovery",
        "preference_weight": 0.95,
        "subtechniques": []
      },
      {
        "technique_id": "T1003.001",
        "name": "LSASS Memory",
        "preference_weight": 0.85,
        "subtechniques": []
      },
      {
        "technique_id": "T1021.001",
        "name": "Remote Desktop Protocol",
        "preference_weight": 0.9,
        "subtechniques": []
      },
      {
        "technique_id": "T1021.002",
        "name": "SMB/Windows Admin Shares",
        "preference_weight": 0.85,
        "subtechniques": []
      },
      {
        "technique_id": "T1482",
        "name": "Domain Trust Discovery",
        "preference_weight": 0.8,
        "subtechniques": []
      },
      {
        "technique_id": "T1560",
        "name": "Archive Collected Data",
        "preference_weight": 0.75,
        "subtechniques": []
      }
    ],
    "tool_preferences": [
      { "tool": "Cobalt Strike", "preference_weight": 0.9 },
      { "tool": "Mimikatz", "preference_weight": 0.95 },
      { "tool": "PsExec", "preference_weight": 0.85 },
      { "tool": "BloodHound", "preference_weight": 0.8 },
      { "tool": "Rubeus", "preference_weight": 0.75 },
      { "tool": "Rclone", "preference_weight": 0.7 },
      { "tool": "7-Zip", "preference_weight": 0.65 }
    ],
    "kill_chain_preferences": {
      "reconnaissance": {
        "duration_bias": "minimal",
        "technique_preferences": ["T1590", "T1591"]
      },
      "initial_access": {
        "duration_bias": "fast",
        "technique_preferences": ["T1566.001", "T1190", "T1133"]
      },
      "execution": {
        "duration_bias": "immediate",
        "technique_preferences": ["T1059.001", "T1204.002"]
      },
      "persistence": {
        "duration_bias": "short_term",
        "technique_preferences": ["T1136", "T1053"]
      },
      "credential_access": {
        "duration_bias": "aggressive",
        "technique_preferences": ["T1003.001", "T1558"]
      },
      "lateral_movement": {
        "duration_bias": "fast",
        "technique_preferences": ["T1021.001", "T1021.002"]
      },
      "impact": {
        "duration_bias": "immediate",
        "technique_preferences": ["T1486", "T1490", "T1489"]
      }
    }
  },
  "behavioral_profile": {
    "working_hours": {
      "timezone": "UTC",
      "start_hour": 0,
      "end_hour": 24,
      "working_days": ["Monday", "Tuesday", "Wednesday", "Thursday", "Friday", "Saturday", "Sunday"]
    },
    "dwell_time": {
      "min_days": 1,
      "max_days": 14,
      "typical_days": 5
    },
    "lateral_movement_style": "aggressive",
    "data_exfil_style": "bulk",
    "c2_patterns": {
      "beacon_interval": "1m",
      "jitter": 0.1,
      "protocols": ["HTTPS", "DNS"]
    }
  },
  "constraints": {
    "can_override_roe": false,
    "can_override_safety": false,
    "can_override_policy": false,
    "respects_blast_radius": true,
    "respects_scope": true
  },
  "planner_biases": {
    "technique_selection": {
      "stealth": 0.4,
      "speed": 0.9,
      "reliability": 0.7
    },
    "target_prioritization": {
      "high_value_targets": 0.6,
      "low_hanging_fruit": 0.9,
      "lateral_movement_potential": 0.85
    },
    "timing_preferences": {
      "business_hours": 0.3,
      "off_hours": 0.8,
      "holidays": 0.9
    },
    "evasion_priorities": {
      "av_evasion": 0.7,
      "edr_evasion": 0.6,
      "network_detection": 0.5,
      "log_evasion": 0.4
    }
  },
  "signature": {
    "algorithm": "ECDSA-P384",
    "value": "PLACEHOLDER_SIGNATURE_BASE64",
    "signer_id": "frostgate-persona-authority",
    "timestamp": "2025-01-01T00:00:00Z"
  },
  "attestation": {
    "hash": "sha256:0000000000000000000000000000000000000000000000000000000000000000",
    "provenance": {
      "builder": "frostgate-persona-builder",
      "build_id": "build-002",
      "source_repo": "https://github.com/internal/adversary-personas",
      "source_commit": "def456"
    },
    "sbom_ref": "sbom/personas/generic_ransomware.spdx.json"
  },
  "metadata": {
    "created_at": "2025-01-01T00:00:00Z",
    "created_by": "threat-intel-team",
    "updated_at": "2025-01-01T00:00:00Z",
    "reviewed_by": "security-review-board",
    "review_date": "2025-01-01T00:00:00Z",
    "tags": ["ransomware", "cybercriminal", "raas", "financially-motivated"],
    "references": [
      "https://attack.mitre.org/techniques/T1486/"
    ]
  }
}
